commit	benchmark_version	pair	track	active_coords	F	D_rope	D_monster	E_rel	E_rope	spectrum	tail	anisotropy	E_eta	N_boost	cone_sep	nonseparability	collapse_fail	status	description
63f8965	monster-v2.0	C	matched-F	x,y	96	384	384	0.000000	0.006086	0.032033	0.067092	0.000783	NA	NA	NA	0.000710	false	keep	phase1 primary calibration: C matched-F
319cda4	monster-v2.0	C	matched-F	x,y	96	384	384	0.000000	0.004759	0.034457	0.052985	0.000927	NA	NA	NA	0.000908	false	keep	hypothesis: increase freq_exponent to 1.1 for C matched-F
319cda4	monster-v2.0	C	matched-F	x,y	96	384	384	0.000000	0.006086	0.032033	0.067092	0.000783	NA	NA	NA	0.000710	false	discard	rerun: pair C matched-F F96
319cda4	monster-v2.0	C	matched-F	x,y	96	384	384	0.000000	0.005504	0.033107	0.061535	0.000841	NA	NA	NA	0.000791	false	discard	sweep: C matched-F F96 freq_exponent=1.04
319cda4	monster-v2.0	C	matched-F	x,y	96	384	384	0.000000	0.005239	0.033611	0.058718	0.000870	NA	NA	NA	0.000831	false	discard	sweep: C matched-F F96 freq_exponent=1.06
319cda4	monster-v2.0	C	matched-F	x,y	96	384	384	0.000000	0.004991	0.034067	0.055880	0.000899	NA	NA	NA	0.000870	false	discard	sweep: C matched-F F96 freq_exponent=1.08
319cda4	monster-v2.0	C	matched-F	x,y	96	384	384	0.000000	0.004759	0.034457	0.052985	0.000927	NA	NA	NA	0.000908	false	keep	sweep: C matched-F F96 freq_exponent=1.10
319cda4	monster-v2.0	C	matched-F	x,y	96	384	384	0.000000	0.004543	0.034763	0.050088	0.000956	NA	NA	NA	0.000945	false	keep	sweep: C matched-F F96 freq_exponent=1.12
319cda4	monster-v2.0	C	matched-F	x,y	96	384	384	0.000000	0.004342	0.034970	0.047097	0.000985	NA	NA	NA	0.000982	false	keep	sweep: C matched-F F96 freq_exponent=1.14
319cda4	monster-v2.0	C	matched-F	x,y	96	384	384	0.000000	0.004155	0.035065	0.044101	0.001014	NA	NA	NA	0.001018	false	keep	sweep: C matched-F F96 freq_exponent=1.16
319cda4	monster-v2.0	C	matched-F	x,y	96	384	384	0.000000	0.003983	0.035040	0.042523	0.001043	NA	NA	NA	0.001053	false	keep	sweep: C matched-F F96 freq_exponent=1.18
319cda4	monster-v2.0	C	matched-F	x,y	96	384	384	0.000000	0.003823	0.034891	0.042725	0.001072	NA	NA	NA	0.001086	false	keep	sweep: C matched-F F96 freq_exponent=1.20
319cda4	monster-v2.0	C	matched-F	x,y	96	384	384	0.000000	0.003676	0.034621	0.042901	0.001101	NA	NA	NA	0.001119	false	keep	sweep: C matched-F F96 freq_exponent=1.22
319cda4	monster-v2.0	C	matched-F	x,y	96	384	384	0.000000	0.003542	0.034235	0.043029	0.001130	NA	NA	NA	0.001151	false	keep	sweep: C matched-F F96 freq_exponent=1.24
319cda4	monster-v2.0	C	matched-F	x,y	96	384	384	0.000000	0.003419	0.033747	0.041851	0.001158	NA	NA	NA	0.001181	false	keep	sweep: C matched-F F96 freq_exponent=1.26
319cda4	monster-v2.0	C	matched-F	x,y	96	384	384	0.000000	0.003307	0.033172	0.039281	0.001187	NA	NA	NA	0.001211	false	keep	sweep: C matched-F F96 freq_exponent=1.28
319cda4	monster-v2.0	C	matched-F	x,y	96	384	384	0.000000	0.003206	0.032532	0.036138	0.001215	NA	NA	NA	0.001239	false	keep	sweep: C matched-F F96 freq_exponent=1.30
319cda4	monster-v2.0	C	matched-F	x,y	96	384	384	0.000000	0.003115	0.031846	0.033055	0.001243	NA	NA	NA	0.001266	false	keep	sweep: C matched-F F96 freq_exponent=1.32
319cda4	monster-v2.0	C	matched-F	x,y	96	384	384	0.000000	0.003034	0.031136	0.030064	0.001270	NA	NA	NA	0.001292	false	keep	sweep: C matched-F F96 freq_exponent=1.34
319cda4	monster-v2.0	C	matched-F	x,y	96	384	384	0.000000	0.002963	0.030420	0.027442	0.001297	NA	NA	NA	0.001317	false	keep	sweep: C matched-F F96 freq_exponent=1.36
319cda4	monster-v2.0	C	matched-F	x,y	96	384	384	0.000000	0.002901	0.029711	0.026360	0.001324	NA	NA	NA	0.001341	false	keep	sweep: C matched-F F96 freq_exponent=1.38
319cda4	monster-v2.0	C	matched-F	x,y	96	384	384	0.000000	0.002849	0.029017	0.024999	0.001350	NA	NA	NA	0.001364	false	keep	sweep: C matched-F F96 freq_exponent=1.40
319cda4	monster-v2.0	C	matched-F	x,y	96	384	384	0.000000	0.002805	0.028340	0.023349	0.001376	NA	NA	NA	0.001386	false	keep	sweep: C matched-F F96 freq_exponent=1.42
319cda4	monster-v2.0	C	matched-F	x,y	96	384	384	0.000000	0.002770	0.027681	0.022519	0.001401	NA	NA	NA	0.001407	false	keep	sweep: C matched-F F96 freq_exponent=1.44
319cda4	monster-v2.0	C	matched-F	x,y	96	384	384	0.000000	0.002743	0.027038	0.021470	0.001425	NA	NA	NA	0.001428	false	keep	sweep: C matched-F F96 freq_exponent=1.46
319cda4	monster-v2.0	C	matched-F	x,y	96	384	384	0.000000	0.002725	0.026412	0.020138	0.001449	NA	NA	NA	0.001448	false	keep	sweep: C matched-F F96 freq_exponent=1.48
319cda4	monster-v2.0	C	matched-F	x,y	96	384	384	0.000000	0.002714	0.025808	0.019339	0.001473	NA	NA	NA	0.001467	false	keep	sweep: C matched-F F96 freq_exponent=1.50
319cda4	monster-v2.0	C	matched-F	x,y	96	384	384	0.000000	0.004490	0.029252	0.040073	0.001761	NA	NA	NA	0.001964	false	discard	binsearch: C matched-F F96 freq_exponent=2.00
319cda4	monster-v2.0	C	matched-F	x,y	96	384	384	0.000000	0.003175	0.024549	0.016542	0.001702	NA	NA	NA	0.001706	false	keep	binsearch: C matched-F F96 freq_exponent=1.75
319cda4	monster-v2.0	C	matched-F	x,y	96	384	384	0.000000	0.003746	0.027468	0.028496	0.001756	NA	NA	NA	0.001834	false	discard	binsearch: C matched-F F96 freq_exponent=1.875
319cda4	monster-v2.0	C	matched-F	x,y	96	384	384	0.000000	0.003436	0.026012	0.022632	0.001735	NA	NA	NA	0.001769	false	discard	binsearch: C matched-F F96 freq_exponent=1.8125
319cda4	monster-v2.0	C	matched-F	x,y	96	384	384	0.000000	0.003299	0.025257	0.019419	0.001720	NA	NA	NA	0.001737	false	discard	binsearch: C matched-F F96 freq_exponent=1.78125
319cda4	monster-v2.0	C	matched-F	x,y	96	384	384	0.000000	0.003235	0.024893	0.017937	0.001712	NA	NA	NA	0.001722	false	discard	binsearch: C matched-F F96 freq_exponent=1.765625
319cda4	monster-v2.0	C	matched-F	x,y	96	384	384	0.000000	0.003205	0.024718	0.017228	0.001707	NA	NA	NA	0.001714	false	discard	binsearch: C matched-F F96 freq_exponent=1.7578125
319cda4	monster-v2.0	C	matched-F	x,y	96	384	384	0.000000	0.002816	0.023329	0.013228	0.001605	NA	NA	NA	0.001585	false	keep	binsearch: C matched-F F96 freq_exponent=1.625
319cda4	monster-v2.0	C	matched-F	x,y	96	384	384	0.000000	0.002730	0.024186	0.015975	0.001542	NA	NA	NA	0.001526	false	discard	binsearch: C matched-F F96 freq_exponent=1.5625
319cda4	monster-v2.0	C	matched-F	x,y	96	384	384	0.000000	0.002966	0.023510	0.013470	0.001659	NA	NA	NA	0.001644	false	discard	binsearch: C matched-F F96 freq_exponent=1.6875
319cda4	monster-v2.0	C	matched-F	x,y	96	384	384	0.000000	0.002765	0.023634	0.013613	0.001574	NA	NA	NA	0.001556	false	discard	binsearch: C matched-F F96 freq_exponent=1.59375
319cda4	monster-v2.0	C	matched-F	x,y	96	384	384	0.000000	0.002883	0.023291	0.013546	0.001633	NA	NA	NA	0.001615	false	discard	binsearch: C matched-F F96 freq_exponent=1.65625
319cda4	monster-v2.0	C	matched-F	x,y	96	384	384	0.000000	0.002788	0.023449	0.013233	0.001590	NA	NA	NA	0.001570	false	discard	binsearch: C matched-F F96 freq_exponent=1.609375
319cda4	monster-v2.0	C	matched-F	x,y	96	384	384	0.000000	0.002848	0.023276	0.013299	0.001619	NA	NA	NA	0.001600	false	discard	binsearch: C matched-F F96 freq_exponent=1.640625
319cda4	monster-v2.0	B	matched-F	x	96	192	384	0.000000	0.005513	0.000000	0.121669	0.000000	NA	NA	NA	0.000000	false	keep	phase2 baseline: B matched-F F96
319cda4	monster-v2.0	F	matched-F	x,y,z	96	576	384	0.000000	0.005952	0.023703	0.063535	0.000271	NA	NA	NA	0.000092	false	keep	phase2 baseline: F matched-F F96
319cda4	monster-v2.0	C	matched-F	x,y	96	384	384	0.000000	0.002816	0.023329	0.013228	0.001605	NA	NA	NA	0.001585	false	keep	checkpoint: C matched-F F96 freq_exponent=1.625
319cda4	monster-v2.0	C	matched-F	x,y	96	384	384	0.000000	0.002822	0.046639	0.022073	0.000925	NA	NA	NA	0.001075	false	discard	grid2d: C matched-F F96 exp=1.625 fs=0.80 rs=0.80
319cda4	monster-v2.0	C	matched-F	x,y	96	384	384	0.000000	0.002318	0.039289	0.009566	0.001198	NA	NA	NA	0.001354	false	discard	grid2d: C matched-F F96 exp=1.625 fs=0.80 rs=1.00
319cda4	monster-v2.0	C	matched-F	x,y	96	384	384	0.000000	0.002673	0.026311	0.012053	0.001530	NA	NA	NA	0.001550	false	discard	grid2d: C matched-F F96 exp=1.625 fs=0.80 rs=1.20
319cda4	monster-v2.0	C	matched-F	x,y	96	384	384	0.000000	0.002318	0.039289	0.009566	0.001198	NA	NA	NA	0.001354	false	discard	grid2d: C matched-F F96 exp=1.625 fs=1.00 rs=0.80
319cda4	monster-v2.0	C	matched-F	x,y	96	384	384	0.000000	0.002816	0.023329	0.013228	0.001605	NA	NA	NA	0.001585	false	keep	grid2d: C matched-F F96 exp=1.625 fs=1.00 rs=1.00
319cda4	monster-v2.0	C	matched-F	x,y	96	384	384	0.000000	0.003611	0.031217	0.016360	0.001846	NA	NA	NA	0.001698	false	discard	grid2d: C matched-F F96 exp=1.625 fs=1.00 rs=1.20
319cda4	monster-v2.0	C	matched-F	x,y	96	384	384	0.000000	0.002673	0.026311	0.012053	0.001530	NA	NA	NA	0.001550	false	discard	grid2d: C matched-F F96 exp=1.625 fs=1.20 rs=0.80
319cda4	monster-v2.0	C	matched-F	x,y	96	384	384	0.000000	0.003611	0.031217	0.016360	0.001846	NA	NA	NA	0.001698	false	discard	grid2d: C matched-F F96 exp=1.625 fs=1.20 rs=1.00
319cda4	monster-v2.0	C	matched-F	x,y	96	384	384	0.000000	0.004611	0.033461	0.034887	0.001935	NA	NA	NA	0.001788	false	discard	grid2d: C matched-F F96 exp=1.625 fs=1.20 rs=1.20
319cda4	monster-v2.0	C	matched-F	x,y	96	384	384	0.000000	0.003188	0.023993	0.015598	0.001658	NA	NA	NA	0.001665	false	discard	sweep-theta: C matched-F F96 exp=1.625 theta_base=3000
319cda4	monster-v2.0	C	matched-F	x,y	96	384	384	0.000000	0.002993	0.023459	0.013716	0.001639	NA	NA	NA	0.001628	false	discard	sweep-theta: C matched-F F96 exp=1.625 theta_base=5000
319cda4	monster-v2.0	C	matched-F	x,y	96	384	384	0.000000	0.002864	0.023302	0.013283	0.001616	NA	NA	NA	0.001598	false	discard	sweep-theta: C matched-F F96 exp=1.625 theta_base=8000
319cda4	monster-v2.0	C	matched-F	x,y	96	384	384	0.000000	0.002816	0.023329	0.013228	0.001605	NA	NA	NA	0.001585	false	keep	sweep-theta: C matched-F F96 exp=1.625 theta_base=10000
319cda4	monster-v2.0	C	matched-F	x,y	96	384	384	0.000000	0.002781	0.023394	0.013225	0.001595	NA	NA	NA	0.001575	false	discard	sweep-theta: C matched-F F96 exp=1.625 theta_base=12000
319cda4	monster-v2.0	C	matched-F	x,y	96	384	384	0.000000	0.002734	0.023568	0.013287	0.001579	NA	NA	NA	0.001560	false	discard	sweep-theta: C matched-F F96 exp=1.625 theta_base=16000
319cda4	monster-v2.0	C	matched-F	x,y	96	384	384	0.000000	0.002680	0.023937	0.013497	0.001556	NA	NA	NA	0.001541	false	discard	sweep-theta: C matched-F F96 exp=1.625 theta_base=24000
319cda4	monster-v2.0	C	matched-F	x,y	96	384	384	0.000000	0.002629	0.024548	0.013934	0.001527	NA	NA	NA	0.001518	false	discard	sweep-theta: C matched-F F96 exp=1.625 theta_base=40000
319cda4	monster-v2.0	C	matched-F	x,y	96	384	384	0.000000	0.002747	0.023849	0.014711	0.001560	NA	NA	NA	0.001543	false	discard	grid2d-exptheta: C matched-F F96 exp=1.58 theta_base=10000
319cda4	monster-v2.0	C	matched-F	x,y	96	384	384	0.000000	0.002704	0.024044	0.014075	0.001550	NA	NA	NA	0.001533	false	discard	grid2d-exptheta: C matched-F F96 exp=1.58 theta_base=12000
319cda4	monster-v2.0	C	matched-F	x,y	96	384	384	0.000000	0.002643	0.024400	0.013926	0.001532	NA	NA	NA	0.001519	false	discard	grid2d-exptheta: C matched-F F96 exp=1.58 theta_base=16000
319cda4	monster-v2.0	C	matched-F	x,y	96	384	384	0.000000	0.002807	0.023360	0.013221	0.001600	NA	NA	NA	0.001580	false	discard	grid2d-exptheta: C matched-F F96 exp=1.62 theta_base=10000
319cda4	monster-v2.0	C	matched-F	x,y	96	384	384	0.000000	0.002771	0.023441	0.013234	0.001590	NA	NA	NA	0.001570	false	discard	grid2d-exptheta: C matched-F F96 exp=1.62 theta_base=12000
319cda4	monster-v2.0	C	matched-F	x,y	96	384	384	0.000000	0.002722	0.023638	0.013322	0.001574	NA	NA	NA	0.001555	false	discard	grid2d-exptheta: C matched-F F96 exp=1.62 theta_base=16000
319cda4	monster-v2.0	C	matched-F	x,y	96	384	384	0.000000	0.002892	0.023305	0.013623	0.001636	NA	NA	NA	0.001618	false	discard	grid2d-exptheta: C matched-F F96 exp=1.66 theta_base=10000
319cda4	monster-v2.0	C	matched-F	x,y	96	384	384	0.000000	0.002865	0.023261	0.013400	0.001627	NA	NA	NA	0.001608	false	discard	grid2d-exptheta: C matched-F F96 exp=1.66 theta_base=12000
319cda4	monster-v2.0	C	matched-F	x,y	96	384	384	0.000000	0.002827	0.023268	0.013265	0.001613	NA	NA	NA	0.001592	false	keep	grid2d-exptheta: C matched-F F96 exp=1.66 theta_base=16000
319cda4	monster-v2.0	C	matched-F	x,y	96	384	384	0.000000	0.002816	0.023329	0.013228	0.001605	NA	NA	NA	0.001585	false	discard	multiseed: C matched-F F96 cfg=old exp=1.625 theta_base=10000 seed=0
319cda4	monster-v2.0	C	matched-F	x,y	96	384	384	0.000000	0.002831	0.025186	0.013972	0.001612	NA	NA	NA	0.001593	false	discard	multiseed: C matched-F F96 cfg=old exp=1.625 theta_base=10000 seed=1
319cda4	monster-v2.0	C	matched-F	x,y	96	384	384	0.000000	0.002827	0.024828	0.013869	0.001614	NA	NA	NA	0.001591	false	discard	multiseed: C matched-F F96 cfg=old exp=1.625 theta_base=10000 seed=2
319cda4	monster-v2.0	C	matched-F	x,y	96	384	384	0.000000	0.002824	0.025077	0.014591	0.001609	NA	NA	NA	0.001585	false	discard	multiseed: C matched-F F96 cfg=old exp=1.625 theta_base=10000 seed=3
319cda4	monster-v2.0	C	matched-F	x,y	96	384	384	0.000000	0.002811	0.024384	0.013825	0.001596	NA	NA	NA	0.001579	false	discard	multiseed: C matched-F F96 cfg=old exp=1.625 theta_base=10000 seed=4
319cda4	monster-v2.0	C	matched-F	x,y	96	384	384	0.000000	0.002827	0.023268	0.013265	0.001613	NA	NA	NA	0.001592	false	keep	multiseed: C matched-F F96 cfg=new exp=1.66 theta_base=16000 seed=0
319cda4	monster-v2.0	C	matched-F	x,y	96	384	384	0.000000	0.002843	0.025113	0.014018	0.001620	NA	NA	NA	0.001600	false	discard	multiseed: C matched-F F96 cfg=new exp=1.66 theta_base=16000 seed=1
319cda4	monster-v2.0	C	matched-F	x,y	96	384	384	0.000000	0.002842	0.024794	0.013911	0.001623	NA	NA	NA	0.001598	false	discard	multiseed: C matched-F F96 cfg=new exp=1.66 theta_base=16000 seed=2
319cda4	monster-v2.0	C	matched-F	x,y	96	384	384	0.000000	0.002839	0.025015	0.014631	0.001617	NA	NA	NA	0.001592	false	discard	multiseed: C matched-F F96 cfg=new exp=1.66 theta_base=16000 seed=3
319cda4	monster-v2.0	C	matched-F	x,y	96	384	384	0.000000	0.002822	0.024326	0.013868	0.001604	NA	NA	NA	0.001586	false	discard	multiseed: C matched-F F96 cfg=new exp=1.66 theta_base=16000 seed=4
319cda4	monster-v2.0	B	matched-F	x	96	192	384	0.000000	0.015640	0.017478	0.202304	0.000000	NA	NA	NA	0.000000	false	discard	phase2-sweep: B matched-F F96 freq_exponent=0.60
319cda4	monster-v2.0	B	matched-F	x	96	192	384	0.000000	0.010198	0.004206	0.161359	0.000000	NA	NA	NA	0.000000	false	discard	phase2-sweep: B matched-F F96 freq_exponent=0.80
319cda4	monster-v2.0	B	matched-F	x	96	192	384	0.000000	0.005513	0.000000	0.121669	0.000000	NA	NA	NA	0.000000	false	discard	phase2-sweep: B matched-F F96 freq_exponent=1.00
319cda4	monster-v2.0	B	matched-F	x	96	192	384	0.000000	0.002318	0.002593	0.089735	0.000000	NA	NA	NA	0.000000	false	keep	phase2-sweep: B matched-F F96 freq_exponent=1.20
319cda4	monster-v2.0	B	matched-F	x	96	192	384	0.000000	0.000702	0.005026	0.064238	0.000000	NA	NA	NA	0.000000	false	keep	phase2-sweep: B matched-F F96 freq_exponent=1.40
319cda4	monster-v2.0	B	matched-F	x	96	192	384	0.000000	0.000484	0.007598	0.056467	0.000000	NA	NA	NA	0.000000	false	keep	phase2-sweep: B matched-F F96 freq_exponent=1.60
319cda4	monster-v2.0	B	matched-F	x	96	192	384	0.000000	0.001404	0.010293	0.057744	0.000000	NA	NA	NA	0.000000	false	discard	phase2-sweep: B matched-F F96 freq_exponent=1.80
319cda4	monster-v2.0	B	matched-F	x	96	192	384	0.000000	0.003209	0.013002	0.061025	0.000000	NA	NA	NA	0.000000	false	discard	phase2-sweep: B matched-F F96 freq_exponent=2.00
319cda4	monster-v2.0	B	matched-F	x	96	192	384	0.000000	0.000434	0.006292	0.056874	0.000000	NA	NA	NA	0.000000	false	keep	phase2-refine: B matched-F F96 freq_exponent=1.50
319cda4	monster-v2.0	B	matched-F	x	96	192	384	0.000000	0.000421	0.006940	0.056569	0.000000	NA	NA	NA	0.000000	false	discard	phase2-refine: B matched-F F96 freq_exponent=1.55
319cda4	monster-v2.0	B	matched-F	x	96	192	384	0.000000	0.000484	0.007598	0.056467	0.000000	NA	NA	NA	0.000000	false	discard	phase2-refine: B matched-F F96 freq_exponent=1.60
319cda4	monster-v2.0	B	matched-F	x	96	192	384	0.000000	0.000618	0.008264	0.056551	0.000000	NA	NA	NA	0.000000	false	discard	phase2-refine: B matched-F F96 freq_exponent=1.65
319cda4	monster-v2.0	B	matched-F	x	96	192	384	0.000000	0.000818	0.008936	0.056801	0.000000	NA	NA	NA	0.000000	false	discard	phase2-refine: B matched-F F96 freq_exponent=1.70
319cda4	monster-v2.0	F	matched-F	x,y,z	96	576	384	0.000000	0.009770	0.028798	0.092126	0.000202	NA	NA	NA	0.000027	false	discard	phase2-sweep: F matched-F F96 freq_exponent=0.80
319cda4	monster-v2.0	F	matched-F	x,y,z	96	576	384	0.000000	0.005952	0.023703	0.063535	0.000271	NA	NA	NA	0.000092	false	keep	phase2-sweep: F matched-F F96 freq_exponent=1.00
319cda4	monster-v2.0	F	matched-F	x,y,z	96	576	384	0.000000	0.003423	0.019682	0.051902	0.000307	NA	NA	NA	0.000198	false	keep	phase2-sweep: F matched-F F96 freq_exponent=1.20
319cda4	monster-v2.0	F	matched-F	x,y,z	96	576	384	0.000000	0.002056	0.017772	0.037442	0.000338	NA	NA	NA	0.000325	false	keep	phase2-sweep: F matched-F F96 freq_exponent=1.40
319cda4	monster-v2.0	F	matched-F	x,y,z	96	576	384	0.000000	0.001633	0.017282	0.029104	0.000380	NA	NA	NA	0.000456	false	keep	phase2-sweep: F matched-F F96 freq_exponent=1.60
319cda4	monster-v2.0	F	matched-F	x,y,z	96	576	384	0.000000	0.001944	0.020438	0.024356	0.000433	NA	NA	NA	0.000577	false	keep	phase2-sweep: F matched-F F96 freq_exponent=1.80
319cda4	monster-v2.0	F	matched-F	x,y,z	96	576	384	0.000000	0.002812	0.025072	0.038047	0.000489	NA	NA	NA	0.000682	false	discard	phase2-sweep: F matched-F F96 freq_exponent=2.00
319cda4	monster-v2.0	F	matched-F	x,y,z	96	576	384	0.000000	0.001709	0.018424	0.024351	0.000406	NA	NA	NA	0.000518	false	keep	phase2-refine: F matched-F F96 freq_exponent=1.70
319cda4	monster-v2.0	F	matched-F	x,y,z	96	576	384	0.000000	0.001808	0.019354	0.023216	0.000419	NA	NA	NA	0.000548	false	keep	phase2-refine: F matched-F F96 freq_exponent=1.75
319cda4	monster-v2.0	F	matched-F	x,y,z	96	576	384	0.000000	0.001944	0.020438	0.024356	0.000433	NA	NA	NA	0.000577	false	discard	phase2-refine: F matched-F F96 freq_exponent=1.80
319cda4	monster-v2.0	F	matched-F	x,y,z	96	576	384	0.000000	0.002115	0.021599	0.025903	0.000447	NA	NA	NA	0.000605	false	discard	phase2-refine: F matched-F F96 freq_exponent=1.85
319cda4	monster-v2.0	F	matched-F	x,y,z	96	576	384	0.000000	0.002318	0.022780	0.030250	0.000461	NA	NA	NA	0.000632	false	discard	phase2-refine: F matched-F F96 freq_exponent=1.90
319cda4	monster-v2.0	F	matched-F	x,y,z	96	576	384	0.000000	0.001754	0.018865	0.023600	0.000412	NA	NA	NA	0.000533	false	keep	phase2-local: F matched-F F96 freq_exponent=1.725
319cda4	monster-v2.0	F	matched-F	x,y,z	96	576	384	0.000000	0.001780	0.019104	0.023417	0.000416	NA	NA	NA	0.000541	false	discard	phase2-local: F matched-F F96 freq_exponent=1.7375
319cda4	monster-v2.0	F	matched-F	x,y,z	96	576	384	0.000000	0.001808	0.019354	0.023216	0.000419	NA	NA	NA	0.000548	false	discard	phase2-local: F matched-F F96 freq_exponent=1.75
319cda4	monster-v2.0	F	matched-F	x,y,z	96	576	384	0.000000	0.001839	0.019614	0.023032	0.000422	NA	NA	NA	0.000556	false	discard	phase2-local: F matched-F F96 freq_exponent=1.7625
319cda4	monster-v2.0	F	matched-F	x,y,z	96	576	384	0.000000	0.001872	0.019882	0.023490	0.000426	NA	NA	NA	0.000563	false	discard	phase2-local: F matched-F F96 freq_exponent=1.775
319cda4	monster-v2.0	F	matched-F	x,y,z	96	576	384	0.000000	0.001730	0.018638	0.023765	0.000409	NA	NA	NA	0.000526	false	keep	phase2-bisect: F matched-F F96 freq_exponent=1.7125
319cda4	monster-v2.0	F	matched-F	x,y,z	96	576	384	0.000000	0.001742	0.018750	0.023685	0.000411	NA	NA	NA	0.000530	false	discard	phase2-bisect: F matched-F F96 freq_exponent=1.71875
319cda4	monster-v2.0	F	matched-F	x,y,z	96	576	384	0.000000	0.001754	0.018865	0.023600	0.000412	NA	NA	NA	0.000533	false	discard	phase2-bisect: F matched-F F96 freq_exponent=1.725
319cda4	monster-v2.0	F	matched-F	x,y,z	96	576	384	0.000000	0.001766	0.018983	0.023511	0.000414	NA	NA	NA	0.000537	false	discard	phase2-bisect: F matched-F F96 freq_exponent=1.73125
319cda4	monster-v2.0	F	matched-F	x,y,z	96	576	384	0.000000	0.001719	0.018529	0.024003	0.000407	NA	NA	NA	0.000522	false	discard	phase2-final: F matched-F F96 freq_exponent=1.70625
319cda4	monster-v2.0	F	matched-F	x,y,z	96	576	384	0.000000	0.001725	0.018583	0.023828	0.000408	NA	NA	NA	0.000524	false	discard	phase2-final: F matched-F F96 freq_exponent=1.709375
319cda4	monster-v2.0	F	matched-F	x,y,z	96	576	384	0.000000	0.001730	0.018638	0.023765	0.000409	NA	NA	NA	0.000526	false	keep	phase2-final: F matched-F F96 freq_exponent=1.7125
319cda4	monster-v2.0	A	matched-F	t	96	192	384	90155819426229309810643707253731894001127324462566845442411018832671366029460044995955935995215478784.000000	162260273734031042353304153342909995142134321429618814261772041885870932426159820678477623279208103936.000000	0.060978	227996945564362564699557833754867381502127597006534008098398329513668872955212992645286860644801804906003780159015034445258456959327503486024592971175384932424111537862300260521533036677931675964138851955038186787091143853097499444557337357326385278276197945143454806835200.000000	7338725348208894219026169337538872098126080065293623223037403397161410222554588122868252527296512.000000	NA	NA	NA	0.000000	false	keep	phase3 baseline: A matched-F F96
