commit	benchmark_version	pair	track	active_coords	F	D_rope	D_monster	E_rel	E_rope	spectrum	tail	anisotropy	E_eta	N_boost	cone_sep	nonseparability	collapse_fail	status	description
6ccbdb4	monster-v2.1	A	matched-F	t	96	192	384	0.002214	0.004409	0.017664	0.683987	0.000015	0.000000	0.251644	NA	0.000000	false	ablation	ablation: A matched-F t_unit sweep t=2.0 s=1.0
6ccbdb4	monster-v2.1	A	matched-F	t	96	192	384	0.048428	0.079162	0.020377	0.737667	0.000314	0.000000	0.768714	NA	0.000000	false	ablation	ablation: A matched-F t_unit sweep t=3.0 s=1.0
6ccbdb4	monster-v2.1	A	matched-F	t	96	192	384	0.000000	0.000000	0.018443	0.655734	0.000000	0.000000	0.003668	NA	0.000000	false	ablation	ablation: A matched-F t_unit sweep t=0.05 s=1.0
6ccbdb4	monster-v2.1	A	matched-F	t	96	192	384	0.000000	0.000000	0.018425	0.655777	0.000000	0.000000	0.007345	NA	0.000000	false	ablation	ablation: A matched-F t_unit sweep t=0.1 s=1.0
6ccbdb4	monster-v2.1	A	matched-F	t	96	192	384	0.000000	0.000000	0.018396	0.655850	0.000000	0.000000	0.011037	NA	0.000000	false	ablation	ablation: A matched-F t_unit sweep t=0.15 s=1.0
6ccbdb4	monster-v2.1	A	matched-F	t	96	192	384	0.000000	0.000000	0.018355	0.655952	0.000000	0.000000	0.014752	NA	0.000000	false	ablation	ablation: A matched-F t_unit sweep t=0.2 s=1.0
6ccbdb4	monster-v2.1	A	matched-F	t	96	192	384	0.000000	0.000000	0.000000	0.000000	0.000000	0.000000	0.000007	NA	0.000000	true	ablation	ablation: A matched-F tanh(k*t) sweep k=0.0001
6ccbdb4	monster-v2.1	A	matched-F	t	96	192	384	0.000000	0.000000	0.000000	0.000000	0.000000	0.000000	0.000014	NA	0.000000	true	ablation	ablation: A matched-F tanh(k*t) sweep k=0.0002
6ccbdb4	monster-v2.1	A	matched-F	t	96	192	384	0.000000	0.000001	0.000000	0.001960	0.000000	0.000000	0.000021	NA	0.000000	true	ablation	ablation: A matched-F tanh(k*t) sweep k=0.0003
6ccbdb4	monster-v2.1	A	matched-F	t	96	192	384	0.000000	0.000001	0.000000	0.002631	0.000000	0.000000	0.000033	NA	0.000000	true	ablation	ablation: A matched-F tanh(k*t) sweep k=0.0005
6ccbdb4	monster-v2.1	A	matched-F	t	96	192	384	0.000000	0.000002	0.000000	0.005581	0.000000	0.000000	0.000048	NA	0.000000	true	ablation	ablation: A matched-F tanh(k*t) sweep k=0.0008
6ccbdb4	monster-v2.1	A	matched-F	t	96	192	384	0.000000	0.000002	0.000000	0.006126	0.000000	0.000000	0.000056	NA	0.000000	true	ablation	ablation: A matched-F tanh(k*t) sweep k=0.001
6ccbdb4	monster-v2.1	A	matched-F	t	96	192	384	0.000000	0.000002	0.000000	0.010013	0.000000	0.000000	0.000081	NA	0.000000	true	ablation	ablation: A matched-F tanh(k*t) sweep k=0.002
6ccbdb4	monster-v2.1	A	matched-F	t	96	192	384	0.000000	0.000001	0.000000	0.011675	0.000000	0.000000	0.000108	NA	0.000000	true	ablation	ablation: A matched-F tanh(k*t) sweep k=0.005
6ccbdb4	monster-v2.1	A	matched-F	t	96	192	384	0.000000	0.000000	0.000000	0.000000	0.000000	0.000000	0.000007	NA	0.000000	true	ablation	ablation: A tanh mk grid k=0.0001 m=1
6ccbdb4	monster-v2.1	A	matched-F	t	96	192	384	0.000000	0.000005	0.013077	0.187773	0.000000	0.000000	0.000467	NA	0.000000	true	ablation	ablation: A tanh mk grid k=0.0001 m=64
6ccbdb4	monster-v2.1	A	matched-F	t	96	192	384	0.000000	0.000006	0.028293	0.310852	0.000000	0.000000	0.001869	NA	0.000000	false	ablation	ablation: A tanh mk grid k=0.0001 m=256
6ccbdb4	monster-v2.1	A	matched-F	t	96	192	384	0.000000	0.000005	0.042128	0.455650	0.000000	0.000000	0.007488	NA	0.000000	false	ablation	ablation: A tanh mk grid k=0.0001 m=1024
6ccbdb4	monster-v2.1	A	matched-F	t	96	192	384	0.000000	0.000008	0.031817	0.513740	0.000000	0.000000	0.015042	NA	0.000000	false	ablation	ablation: A tanh mk grid k=0.0001 m=2048
6ccbdb4	monster-v2.1	A	matched-F	t	96	192	384	0.000001	0.000021	0.023648	0.575644	0.000000	0.000000	0.030613	NA	0.000000	false	ablation	ablation: A tanh mk grid k=0.0001 m=4096
6ccbdb4	monster-v2.1	A	matched-F	t	96	192	384	0.000000	0.000001	0.000000	0.001960	0.000000	0.000000	0.000021	NA	0.000000	true	ablation	ablation: A tanh mk grid k=0.0003 m=1
6ccbdb4	monster-v2.1	A	matched-F	t	96	192	384	0.000000	0.000006	0.026742	0.271447	0.000000	0.000000	0.001356	NA	0.000000	false	ablation	ablation: A tanh mk grid k=0.0003 m=64
6ccbdb4	monster-v2.1	A	matched-F	t	96	192	384	0.000000	0.000006	0.033904	0.428863	0.000000	0.000000	0.005428	NA	0.000000	false	ablation	ablation: A tanh mk grid k=0.0003 m=256
6ccbdb4	monster-v2.1	A	matched-F	t	96	192	384	0.000000	0.000008	0.030903	0.549719	0.000000	0.000000	0.021944	NA	0.000000	false	ablation	ablation: A tanh mk grid k=0.0003 m=1024
6ccbdb4	monster-v2.1	A	matched-F	t	96	192	384	0.000005	0.000037	0.024422	0.610425	0.000000	0.000000	0.045379	NA	0.000000	false	ablation	ablation: A tanh mk grid k=0.0003 m=2048
6ccbdb4	monster-v2.1	A	matched-F	t	96	192	384	0.000099	0.000251	0.033500	0.674057	0.000001	0.000000	0.103223	NA	0.000000	false	ablation	ablation: A tanh mk grid k=0.0003 m=4096
6ccbdb4	monster-v2.1	A	matched-F	t	96	192	384	0.000000	0.000001	0.000000	0.002631	0.000000	0.000000	0.000033	NA	0.000000	true	ablation	ablation: A tanh mk grid k=0.0005 m=1
6ccbdb4	monster-v2.1	A	matched-F	t	96	192	384	0.000000	0.000006	0.027101	0.320184	0.000000	0.000000	0.002135	NA	0.000000	false	ablation	ablation: A tanh mk grid k=0.0005 m=64
6ccbdb4	monster-v2.1	A	matched-F	t	96	192	384	0.000000	0.000006	0.035650	0.466370	0.000000	0.000000	0.008554	NA	0.000000	false	ablation	ablation: A tanh mk grid k=0.0005 m=256
6ccbdb4	monster-v2.1	A	matched-F	t	96	192	384	0.000001	0.000024	0.032040	0.585251	0.000000	0.000000	0.035010	NA	0.000000	false	ablation	ablation: A tanh mk grid k=0.0005 m=1024
6ccbdb4	monster-v2.1	A	matched-F	t	96	192	384	0.000023	0.000131	0.029442	0.653091	0.000000	0.000000	0.075177	NA	0.000000	false	ablation	ablation: A tanh mk grid k=0.0005 m=2048
6ccbdb4	monster-v2.1	A	matched-F	t	96	192	384	0.000625	0.001786	0.046382	0.722095	0.000006	0.000000	0.197168	NA	0.000000	false	ablation	ablation: A tanh mk grid k=0.0005 m=4096
6ccbdb4	monster-v2.1	A	matched-F	t	96	192	384	0.000000	0.000002	0.000000	0.006126	0.000000	0.000000	0.000056	NA	0.000000	true	ablation	ablation: A tanh mk grid k=0.001 m=1
6ccbdb4	monster-v2.1	A	matched-F	t	96	192	384	0.000000	0.000006	0.025694	0.381851	0.000000	0.000000	0.003574	NA	0.000000	false	ablation	ablation: A tanh mk grid k=0.001 m=64
6ccbdb4	monster-v2.1	A	matched-F	t	96	192	384	0.000000	0.000007	0.035347	0.511966	0.000000	0.000000	0.014339	NA	0.000000	false	ablation	ablation: A tanh mk grid k=0.001 m=256
6ccbdb4	monster-v2.1	A	matched-F	t	96	192	384	0.000004	0.000064	0.028934	0.634003	0.000000	0.000000	0.060046	NA	0.000000	false	ablation	ablation: A tanh mk grid k=0.001 m=1024
6ccbdb4	monster-v2.1	A	matched-F	t	96	192	384	0.000076	0.000811	0.038257	0.696268	0.000000	0.000000	0.137945	NA	0.000000	false	ablation	ablation: A tanh mk grid k=0.001 m=2048
6ccbdb4	monster-v2.1	A	matched-F	t	96	192	384	0.002945	0.022179	0.040879	0.793748	0.000035	0.000000	0.461192	NA	0.000000	false	ablation	ablation: A tanh mk grid k=0.001 m=4096
